{"asw_version":null,"base_commit":"7d6e267c6e89cdcd8a71644c67c95d2ab4260330","baseline_verification":{"core_status":[],"core_worktree_clean":true,"extension_status_excluded":["?? ../asw-evaluation-extension-codex/"],"full_status":["?? ../asw-evaluation-extension-codex/"],"full_worktree_clean":false},"baseline_versions":{"asw":"v1","filesystem_watch":"v1","ordinary_notification":"v1","polling":"v1","repeated_observation":"v1"},"completed_at":"2026-08-02T08:59:50Z","ground_truth_path":"ground-truth.jsonl","harness_version":"1.0.0","host":{"config_toml":"C:\\Users\\USER\\.codex\\config.toml","machine":"AMD64","os":"Windows-10-10.0.22000-SP0","processor":"Intel64 Family 6 Model 61 Stepping 4, GenuineIntel","python":"3.11.9","runtime":"cpython"},"profile_digest":"sha256:9ef5d7cdee59b4be8ebf9be54c407e1effcac37a46345d26390ce2277fe03647","raw_results_path":"raw-results.jsonl","run_id":"asw-mvp-eval-20260802-04","scenario_versions":{"file_artifact_transition":"v1","job_completion":"v1","process_crash_restart":"v1","render_export":"v1","ui_transition":"v1"},"schema_version":"asw.evaluation_run_manifest.v1","started_at":"2026-08-02T08:58:34Z"}
